{
  "$schema": "http://json-schema.org/draft-04/schema#",
  "id": "semantic_mapping",
  "title": "Semantic Mapping",
  "type": "object",
  "namespace": "urn:nmmi:lu177-psma:model",
  "category": "administrative",
  "program": "*",
  "project": "*",
  "description": "Versioned binding between a model node or property and an external vocabulary concept.",
  "additionalProperties": false,
  "submittable": true,
  "validators": null,
  "links": [
    {
      "name": "model_releases",
      "backref": "nmmi_semantic_mapping_model_releases",
      "label": "defines",
      "target_type": "model_release",
      "multiplicity": "many_to_one",
      "required": true
    }
  ],
  "required": [
    "type",
    "submitter_id",
    "model_releases",
    "node_name",
    "vocabulary",
    "mapping_status"
  ],
  "uniqueKeys": [
    [
      "id"
    ],
    [
      "project_id",
      "submitter_id"
    ]
  ],
  "systemProperties": [
    "id",
    "project_id",
    "state",
    "created_datetime",
    "updated_datetime"
  ],
  "properties": {
    "type": {
      "enum": [
        "semantic_mapping"
      ]
    },
    "submitter_id": {
      "type": "string",
      "description": "Stable submitter-assigned identifier, unique within a project. Do not encode direct patient identifiers.",
      "minLength": 1
    },
    "id": {
      "pattern": "^[a-fA-F0-9]{8}-[a-fA-F0-9]{4}-[a-fA-F0-9]{4}-[a-fA-F0-9]{4}-[a-fA-F0-9]{12}$",
      "systemAlias": "node_id",
      "term": {
        "description": "A 128-bit identifier. Depending on the mechanism used to generate it, it is either guaranteed to be different from all other UUIDs/GUIDs generated until 3400 AD or extremely likely to be different. Its relatively small size lends itself well to sorting, ordering, and hashing of all sorts, storing in databases, simple allocation, and ease of programming in general.\n",
        "termDef": {
          "cde_id": "C54100",
          "cde_version": null,
          "source": "NCIt",
          "term": "Universally Unique Identifier",
          "term_url": "https://ncit.nci.nih.gov/ncitbrowser/ConceptReport.jsp?dictionary=NCI_Thesaurus&version=16.02d&ns=NCI_Thesaurus&code=C54100"
        }
      },
      "type": "string"
    },
    "project_id": {
      "term": {
        "description": "Unique ID for any specific defined piece of work that is undertaken or attempted to meet a single requirement.\n"
      },
      "type": "string"
    },
    "state": {
      "default": "validated",
      "downloadable": [
        "uploaded",
        "md5summed",
        "validating",
        "validated",
        "error",
        "invalid",
        "released"
      ],
      "oneOf": [
        {
          "enum": [
            "uploading",
            "uploaded",
            "md5summing",
            "md5summed",
            "validating",
            "error",
            "invalid",
            "suppressed",
            "redacted",
            "live"
          ]
        },
        {
          "enum": [
            "validated",
            "submitted",
            "released"
          ]
        }
      ],
      "public": [
        "live"
      ],
      "term": {
        "description": "The current state of the object.\n"
      }
    },
    "created_datetime": {
      "oneOf": [
        {
          "format": "date-time",
          "type": "string"
        },
        {
          "type": "null"
        }
      ],
      "term": {
        "description": "A combination of date and time of day in the form [-]CCYY-MM-DDThh:mm:ss[Z|(+|-)hh:mm]\n"
      }
    },
    "updated_datetime": {
      "oneOf": [
        {
          "format": "date-time",
          "type": "string"
        },
        {
          "type": "null"
        }
      ],
      "term": {
        "description": "A combination of date and time of day in the form [-]CCYY-MM-DDThh:mm:ss[Z|(+|-)hh:mm]\n"
      }
    },
    "model_releases": {
      "type": "array",
      "items": {
        "type": "object",
        "additionalProperties": false,
        "properties": {
          "submitter_id": {
            "type": "string",
            "minLength": 1
          },
          "id": {
            "pattern": "^[a-fA-F0-9]{8}-[a-fA-F0-9]{4}-[a-fA-F0-9]{4}-[a-fA-F0-9]{4}-[a-fA-F0-9]{12}$",
            "term": {
              "description": "A 128-bit identifier. Depending on the mechanism used to generate it, it is either guaranteed to be different from all other UUIDs/GUIDs generated until 3400 AD or extremely likely to be different. Its relatively small size lends itself well to sorting, ordering, and hashing of all sorts, storing in databases, simple allocation, and ease of programming in general.\n",
              "termDef": {
                "cde_id": "C54100",
                "cde_version": null,
                "source": "NCIt",
                "term": "Universally Unique Identifier",
                "term_url": "https://ncit.nci.nih.gov/ncitbrowser/ConceptReport.jsp?dictionary=NCI_Thesaurus&version=16.02d&ns=NCI_Thesaurus&code=C54100"
              }
            },
            "type": "string"
          }
        },
        "oneOf": [
          {
            "required": [
              "submitter_id"
            ]
          },
          {
            "required": [
              "id"
            ]
          }
        ]
      },
      "uniqueItems": true,
      "description": "Link to model_release records by submitter_id or UUID.",
      "minItems": 1,
      "maxItems": 1
    },
    "model_version": {
      "type": "string",
      "description": "Version of the submitting theranostics extension, independently of the MIDRC baseline version."
    },
    "record_status": {
      "type": "string",
      "description": "Record curation state, independent of clinical value.",
      "enum": [
        "draft",
        "reviewed",
        "approved",
        "superseded",
        "withdrawn"
      ]
    },
    "source_record_id": {
      "type": "string",
      "description": "Identifier of the originating source record; use an approved pseudonym when needed."
    },
    "source_system": {
      "type": "string",
      "description": "Source system or data provider."
    },
    "missing_properties": {
      "type": "array",
      "description": "Names of properties missing from this record; no missing value is encoded as zero.",
      "items": {
        "type": "string"
      }
    },
    "missing_reasons": {
      "type": "array",
      "description": "Reasons corresponding by index to missing_properties.",
      "items": {
        "enum": [
          "unknown",
          "not_collected",
          "not_applicable",
          "not_available",
          "withheld",
          "pending"
        ]
      }
    },
    "node_name": {
      "type": "string",
      "description": "Model node being mapped."
    },
    "property_name": {
      "type": "string",
      "description": "Model property being mapped; omit for node-level mapping."
    },
    "source_element_id": {
      "type": "string",
      "description": "Source catalog element when mapping applies to a normalized field."
    },
    "concept_id": {
      "type": "string",
      "description": "External concept identifier or URI. Do not mint an apparent NucLex identifier."
    },
    "vocabulary": {
      "type": "string",
      "description": "Name of external vocabulary."
    },
    "vocabulary_version": {
      "type": "string",
      "description": "Exact vocabulary release."
    },
    "preferred_term": {
      "type": "string",
      "description": "External preferred label."
    },
    "mapping_relation": {
      "type": "string",
      "description": "Exact, broader, narrower, related or unresolved correspondence."
    },
    "definition_source": {
      "type": "string",
      "description": "Source of definition."
    },
    "reviewer": {
      "type": "string",
      "description": "Reviewer role or approved reviewer identifier."
    },
    "mapping_status": {
      "type": "string",
      "description": "Status of mapping assertion.",
      "enum": [
        "unmapped",
        "candidate",
        "reviewed",
        "approved",
        "deprecated"
      ]
    }
  }
}
